<?xml version="1.0" encoding="UTF-8"?>
<!-- edited with XMLSpy v2008 rel. 2 (http://www.altova.com) by mazuki (darksiderg) -->
<xs:schema xmlns:xs="http://www.w3.org/2001/XMLSchema" elementFormDefault="qualified" attributeFormDefault="unqualified">
	<xs:element name="LevelTbl">
		<xs:annotation>
			<xs:documentation>Level up table</xs:documentation>
		</xs:annotation>
		<xs:complexType>
			<xs:sequence>
				<xs:element name="LevelItem" maxOccurs="unbounded">
					<xs:complexType>
						<xs:attribute name="Level" use="required">
							<xs:simpleType>
								<xs:restriction base="xs:int">
									<xs:minInclusive value="1"/>
								</xs:restriction>
							</xs:simpleType>
						</xs:attribute>
						<xs:attribute name="RequiredExpTotal" use="required">
							<xs:simpleType>
								<xs:restriction base="xs:int">
									<xs:minInclusive value="1"/>
								</xs:restriction>
							</xs:simpleType>
						</xs:attribute>
					</xs:complexType>
				</xs:element>
			</xs:sequence>
		</xs:complexType>
	</xs:element>
</xs:schema>
